"question","answer"
"How can I manage symptoms of panic attacks through self-help techniques?","Self-help for panic attacks includes deep breathing, grounding exercises (5-4-3-2-1 method), reminding yourself it's temporary, and challenging catastrophic thoughts."
"What is a mental health crisis plan, and why is it important?","A mental health crisis plan outlines steps to take when mental health symptoms escalate. It's important for ensuring safety, getting timely help, and guiding support people during a crisis."
"How can I support a friend who is experiencing a depressive episode?","Listen without judgment, offer practical help (e.g., prepare a meal), encourage small activities, validate their feelings, and gently suggest seeking or continuing professional help."
"What are the mental health benefits of spending time in nature beyond just stress reduction?","Beyond stress reduction, nature exposure improves mood, increases cognitive function, enhances creativity, and fosters a sense of connection and awe."
"How does psychotherapy help individuals develop coping mechanisms?","Psychotherapy helps by teaching specific coping skills, exploring underlying emotional patterns, providing a safe space to practice new behaviors, and offering alternative perspectives."
"What is the role of spirituality in addiction recovery?","For many, spirituality provides a framework for recovery, offering hope, community, purpose, and practices (like meditation or prayer) that support sobriety and personal growth."
"How can I use guided imagery to manage anxiety and promote relaxation?","Guided imagery involves listening to descriptions that evoke calm and peaceful mental pictures. It helps distract from anxious thoughts and promotes physiological relaxation."
"What are the mental health benefits of engaging in creative writing or poetry?","Creative writing offers an outlet for emotions, helps process experiences, improves self-expression, reduces stress, and can provide a sense of accomplishment and clarity."
"How can I manage feelings of envy or jealousy that affect my mental health?","Manage envy/jealousy by acknowledging the feelings without judgment, practicing gratitude for what you have, focusing on your own goals, and celebrating others' successes."
"What are the mental health benefits of setting clear personal values?","Setting clear personal values provides a compass for decision-making, increases authenticity, reduces internal conflict, and contributes to a sense of purpose and fulfillment."
"How can I support someone experiencing a psychotic episode while ensuring my own safety?","Prioritize your safety first. Remain calm, avoid arguments, express empathy, gently guide them to professional help, and remove any dangerous objects."
"What is the concept of ""flow state,"" and how does it relate to mental well-being?","A flow state is a state of complete absorption in an activity, characterized by intense focus, timelessness, and enjoyment. Achieving flow can boost mood, reduce stress, and increase feelings of competence."
"How can I develop healthier coping strategies for stress than unhealthy ones (e.g., emotional eating)?","Identify triggers for unhealthy coping, explore alternative healthy strategies (exercise, journaling), practice mindfulness, and seek support to replace old patterns with new ones."
"What are the mental health benefits of building strong self-esteem?","Strong self-esteem leads to greater confidence, resilience, healthier relationships, reduced anxiety and depression, and a greater willingness to take healthy risks."
"How can I use progressive muscle relaxation to fall asleep faster and improve sleep quality?","By systematically tensing and relaxing muscle groups, PMR helps release physical tension, calm the mind, and prepare the body for sleep, leading to faster onset and deeper rest."
"What is the impact of chronic pain on mental health, and how can integrated care help?","Chronic pain often leads to depression, anxiety, and stress due to its persistent nature and impact on daily life. Integrated care (combining pain management with mental health support) addresses both aspects holistically."
"How can I build stronger social connections for improved mental health, especially if I'm introverted?","Introverts can build strong connections through quality over quantity: focusing on deeper conversations with a few trusted individuals, joining smaller groups with shared interests, and online communities."
"What are the mental health benefits of engaging in mindful movement practices (e.g., yoga, tai chi)?","Mindful movement integrates physical activity with present-moment awareness, reducing stress, improving flexibility, enhancing body awareness, and fostering emotional regulation."
"How can I help a friend who is talking about self-harm, even if they say they are ""just venting""?","Take all self-harm talk seriously. Express concern, listen, ask if they have a plan, and connect them immediately to crisis resources or mental health professionals. Don't dismiss their feelings."
"What are the ethical considerations when discussing someone else's mental health?","Maintain confidentiality, avoid gossip, respect their privacy, don't diagnose, and encourage them to seek professional help rather than offering unqualified advice."
"How can I manage feelings of inadequacy and self-doubt in my professional life?","Manage inadequacy by focusing on effort over outcome, celebrating small wins, seeking constructive feedback, practicing self-compassion, and recognizing that everyone has challenges."
"What are the benefits of engaging in community service for mental well-being?","Community service provides a sense of purpose, increases social connection, reduces feelings of isolation, boosts self-esteem, and shifts focus from personal problems to helping others."
"How can I use expressive arts (music, dance) to process emotions and reduce stress?","Music can evoke and process emotions, dance can release physical tension and express feelings, and both provide a non-verbal outlet for stress reduction and self-discovery."
"What are the mental health benefits of regularly practicing gratitude, beyond just feeling good?","Regular gratitude practice can lead to increased optimism, improved physical health, stronger relationships, and a greater sense of life satisfaction over time."
"How can I identify if I am being a good support system for a friend with mental health issues?","You're a good support system if you listen non-judgmentally, offer practical help, respect their boundaries, encourage professional help, and prioritize your own well-being."
"What is the impact of nature exposure on stress hormones and brain activity?","Nature exposure lowers cortisol (stress hormone) levels, reduces activity in brain areas associated with rumination, and increases activity in areas related to calm and positive emotion."
"How can I build a healthier relationship with technology for better mental health?","Set boundaries for tech use, create tech-free zones/times, be mindful of content, prioritize in-person interactions, and use technology intentionally for connection or learning rather than passive consumption."
"What are the mental health benefits of cultivating optimism and hope?","Optimism and hope contribute to greater resilience, better coping skills, improved physical health, and increased motivation to pursue goals and overcome challenges."
"How can I support someone experiencing a panic attack in a public place?","Find a quiet space, offer a water bottle, guide their breathing, reassure them it will pass, and help them feel grounded by focusing on immediate surroundings."
"What are the mental health benefits of engaging in meaningful leisure activities?","Meaningful leisure activities provide relaxation, stress reduction, a sense of accomplishment, opportunities for social connection, and a break from daily pressures."
"How does attachment style influence mental health and relationships?","Attachment styles (secure, anxious, avoidant, disorganized) formed in early childhood can influence how individuals form and maintain relationships, cope with stress, and regulate emotions, impacting mental health."
"What is the concept of ""self-talk,"" and how can I make it more positive?","Self-talk is the internal dialogue you have with yourself. Make it more positive by identifying negative patterns, challenging irrational thoughts, and replacing them with compassionate and realistic affirmations."
"How can I manage anticipatory grief when a loved one has a terminal illness?","Manage anticipatory grief by allowing yourself to feel emotions, communicating openly with your loved one, seeking support from others, cherishing moments, and considering grief counseling."
"What are the mental health benefits of having a diverse social circle?","A diverse social circle provides varied perspectives, exposes you to new ideas, broadens your understanding, and enriches your life experience, contributing to intellectual and emotional growth."
"How can I encourage open communication about mental health within my family?","Lead by example by sharing your own feelings (appropriately), create a safe space for others to share, listen without judgment, validate emotions, and educate family members about mental health."
"What is the concept of ""learned helplessness,"" and how can I overcome it?","Learned helplessness is a state where an individual feels unable to avoid pain or control outcomes, even when opportunities for change exist, due to repeated negative experiences. Overcome it by focusing on small, achievable steps, recognizing agency, and seeking therapy."
"How can I use progressive muscle relaxation to reduce general anxiety in daily life?","Practice PMR regularly to become aware of muscle tension and to actively release it. This can reduce overall anxiety and help you feel more relaxed and in control throughout the day."
"What are the mental health benefits of engaging in acts of kindness?","Acts of kindness release feel-good chemicals, boost mood, foster a sense of connection, increase self-esteem, and create a positive feedback loop that benefits both giver and receiver."
"How can I manage the emotional impact of social comparison related to career or achievements?","Focus on your unique path and progress, celebrate your own milestones, avoid comparing your journey to others' highlights, and remember success is defined individually."
"What are the benefits of pursuing a passion or hobby for mental health?","Pursuing a passion provides a sense of purpose, boosts creativity, reduces stress, offers a healthy escape, and can lead to a state of ""flow,"" improving overall well-being."
"How can I recognize the signs of a panic attack versus other anxiety symptoms?","Panic attacks are sudden, intense episodes of fear with severe physical symptoms (racing heart, shortness of breath, dizziness) that peak quickly. Other anxiety symptoms are more sustained and less acute."
"What are the mental health benefits of forgiveness towards others who have wronged you?","Forgiveness can reduce resentment, anger, and stress, improve emotional well-being, and free you from being emotionally tied to past hurts. It does not mean condoning behavior."
"How can I support someone with a chronic mental illness who is struggling with treatment adherence?","Understand their reasons for non-adherence, offer gentle encouragement, help them problem-solve barriers, accompany them to appointments, and work with their healthcare team."
"What is mindfulness-based stress reduction (MBSR), and how can it help with chronic stress?","MBSR is an 8-week program using meditation, yoga, and inquiry to teach mindfulness. It helps chronic stress by increasing awareness of thoughts/feelings, promoting non-judgmental acceptance, and building coping skills."
"How can I use expressive arts therapy to process grief and loss?","Expressive arts offer a non-verbal outlet for complex emotions associated with grief. Art, music, or movement can help individuals externalize feelings, find meaning, and integrate loss into their lives."
"What are the mental health benefits of setting realistic goals?","Setting realistic goals reduces pressure, prevents burnout, fosters a sense of accomplishment, and allows for consistent progress, boosting motivation and self-esteem."
"How can I manage the impact of financial instability on my mental health?","Acknowledge the stress, create a detailed financial plan, seek professional advice, explore community resources, and focus on small, actionable steps to regain control."
"What are the signs of healthy boundaries in family relationships?","Clear communication of needs, mutual respect for individual space and decisions, ability to say no without guilt, and a balance of giving and receiving."
"How does resilience contribute to bouncing back from mental health setbacks?","Resilience allows individuals to adapt to adversity, learn from challenging experiences, maintain a positive outlook, and seek support, enabling them to recover more effectively from setbacks."
"What are the mental health benefits of developing a positive body image?","A positive body image contributes to higher self-esteem, reduced anxiety about appearance, healthier eating and exercise habits, and a greater overall sense of well-being."
"How can I use guided meditation to improve sleep and reduce anxiety?","Guided meditation provides calming narratives and instructions for relaxation, helping to quiet the mind, reduce physiological arousal, and prepare the body for restful sleep."
"What are some common challenges individuals face when seeking mental health support for the first time?","Challenges include overcoming stigma, finding the right provider, understanding costs and insurance, and feeling vulnerable about opening up to a stranger."
"How can I build stronger social bonds if I have social anxiety?","Start with small steps: practice eye contact, initiate brief conversations, join a low-pressure group, and gradually increase exposure. Therapy can provide structured support."
"What is the mental health impact of chronic loneliness, and how can it be addressed?","Chronic loneliness can lead to depression, anxiety, stress, and even physical health problems. Address it by actively seeking social connections, joining groups, volunteering, and building new relationships."
"How can I foster a more positive mindset when dealing with negative self-talk?","Challenge negative thoughts, identify cognitive distortions, practice self-compassion, use positive affirmations, and focus on solutions rather than problems."
"What are the mental health benefits of connecting with nature through activities like gardening or hiking?","Gardening and hiking reduce stress, improve mood, increase physical activity, offer a sense of accomplishment, and provide opportunities for mindfulness and connection with the environment."
"How can I effectively manage stress in a busy and demanding lifestyle?","Prioritize tasks, delegate when possible, set boundaries, practice time management, schedule regular breaks, and incorporate stress-reduction techniques into your daily routine."
"What are the mental health benefits of learning and practicing mindfulness daily?","Daily mindfulness practice reduces stress, improves emotional regulation, increases self-awareness, enhances focus, and cultivates a greater sense of calm and presence."
"How can I support a family member with obsessive-compulsive disorder (OCD)?","Educate yourself about OCD, encourage treatment adherence, avoid enabling compulsions, focus on positive reinforcement, and practice patience and understanding."
"What is the concept of ""self-compassion,"" and how does it differ from self-esteem?","Self-compassion is treating oneself with kindness and understanding during times of suffering or perceived inadequacy. It differs from self-esteem in that it's not based on external achievements or comparisons."
"How can I use gratitude practice to improve my relationships?","Expressing gratitude to others strengthens bonds, increases positive emotions, and fosters a sense of appreciation and connection within relationships."
"What are the ethical considerations when a mental health professional encounters a dual relationship?","Dual relationships (e.g., therapist also being a friend or business partner) can create conflicts of interest and impair objectivity. Ethical guidelines generally advise against them due to potential harm to the client."
"How can I build emotional resilience after experiencing a traumatic event?","Build emotional resilience by seeking professional therapy (e.g., trauma-informed CBT, EMDR), building a strong support system, practicing self-care, and engaging in activities that bring meaning."
"What is the role of humor in coping with anxiety and depression?","Humor can provide a temporary escape, reduce tension, shift perspective, and make challenging situations feel more manageable, acting as a healthy coping mechanism."
"How can I manage chronic stress to prevent burnout and mental health decline?","Manage chronic stress through regular exercise, balanced nutrition, sufficient sleep, mindfulness, setting boundaries, social support, and seeking professional help if needed."
"What are the mental health benefits of engaging in physical activities that you enjoy?","Engaging in enjoyable physical activities increases adherence, releases endorphins, reduces stress, improves mood, and provides a sense of accomplishment and fun, contributing to overall well-being."
"How can I use cognitive behavioral therapy (CBT) techniques in my daily life for anxiety management?","CBT techniques include identifying negative thought patterns, challenging irrational beliefs, practicing relaxation, and gradually exposing yourself to feared situations."
"What are the mental health benefits of a strong support network beyond just friends and family?","A strong support network can include colleagues, community groups, online forums, and mentors, providing diverse perspectives, resources, and a sense of belonging beyond immediate circles."
"How can I differentiate between normal mood swings and bipolar disorder?","Normal mood swings are typically reactions to life events and are less extreme or prolonged. Bipolar disorder involves distinct episodes of elevated mood (mania/hypomania) and depressed mood that significantly impact functioning."
"What are the mental health benefits of active listening in conversations?","Active listening improves communication, strengthens relationships, fosters empathy, reduces misunderstandings, and makes others feel heard and valued, contributing to overall emotional connection."
"How can I support someone experiencing hallucinations or delusions responsibly?","Stay calm, don't argue with their reality, express empathy for their distress, ensure their safety, and encourage immediate professional help."
"What is the impact of negative self-talk on mental health, and how can I challenge it?","Negative self-talk erodes self-esteem, increases anxiety and depression, and can be self-fulfilling. Challenge it by recognizing the thought, questioning its validity, and replacing it with a more balanced perspective."
"How can I use expressive writing as a tool for emotional processing and healing?","Expressive writing allows you to freely explore emotions and experiences on paper, providing an outlet for catharsis, gaining insights, and promoting emotional healing."
"What are the mental health benefits of prioritizing self-care in a busy schedule?","Prioritizing self-care prevents burnout, reduces stress, boosts energy, improves focus, and enhances overall mental and physical well-being, making you more effective in other areas of life."
