"question","answer"
"What are the different types of mood disorders?","Mood disorders include Major Depressive Disorder, Bipolar Disorder (Type I and II), Cyclothymic Disorder, and Persistent Depressive Disorder (Dysthymia)."
"How can I help a friend who is experiencing suicidal ideation but is hesitant to seek help?","Express your concern directly and calmly, listen without judgment, validate their feelings, and offer to help them find resources or accompany them to an appointment. Emphasize that help is available and they don't have to go through it alone."
"What are the mental health benefits of spending time in nature?","Spending time in nature reduces stress, improves mood, boosts cognitive function, and can alleviate symptoms of depression and anxiety by promoting relaxation and mindfulness."
"How can I deal with perfectionism that negatively impacts my mental health?","Deal with perfectionism by setting realistic standards, embracing mistakes as learning opportunities, practicing self-compassion, focusing on progress over perfection, and challenging all-or-nothing thinking."
"What is the concept of ""burnout"" in the context of mental health?","Burnout is a state of emotional, physical, and mental exhaustion caused by prolonged or excessive stress. It's characterized by cynicism, detachment, and feelings of ineffectiveness, particularly in work or caregiving roles."
"How can I use progressive muscle relaxation to reduce anxiety?","Progressive muscle relaxation involves tensing and then relaxing different muscle groups throughout the body. It helps reduce physical tension associated with anxiety and promotes overall relaxation."
"What are the signs of a healthy romantic relationship from a mental health perspective?","Signs include mutual respect, open communication, trust, support for individual growth, healthy conflict resolution, shared values, and a sense of emotional safety."
"How can I support my child's mental health at school?","Support your child's mental health at school by maintaining open communication, listening to their concerns, collaborating with teachers, addressing bullying, and seeking professional help if needed."
"What are the mental health benefits of creative expression (e.g., painting, music, writing)?","Creative expression provides an outlet for emotions, reduces stress, boosts self-esteem, improves problem-solving skills, and can foster a sense of accomplishment and purpose."
"How can I manage chronic fatigue that affects my mental health?","Managing chronic fatigue involves addressing underlying medical conditions, optimizing sleep, managing stress, pacing activities, and seeking support from healthcare professionals."
"What is a mental health ""toolkit"" for myself, and what should it include?","A mental health toolkit is a personalized collection of resources and strategies to use during difficult times. It might include journaling, meditation apps, stress balls, comfort items, a list of calming activities, contact info for support, and positive affirmations."
"How does gratitude journaling specifically benefit mental health?","Gratitude journaling shifts focus to positive aspects of life, fostering optimism, reducing negative emotions, improving sleep, and strengthening relationships by increasing appreciation."
"What are some strategies for building self-awareness for better mental health?","Strategies include journaling, mindfulness meditation, reflection, seeking feedback from trusted individuals, and paying attention to your thoughts, emotions, and physical sensations."
"How can I help someone who is isolating themselves due to mental health struggles?","Reach out gently, express your concern without judgment, offer practical help (e.g., bringing food), invite them to low-pressure activities, and encourage them to seek professional help."
"What is the impact of financial stress on mental health, and how can I cope?","Financial stress can cause significant anxiety, depression, and hopelessness. Cope by creating a budget, seeking financial advice, reducing unnecessary expenses, and focusing on small, actionable steps."
"How can I use visualization techniques to improve mental well-being?","Visualization involves creating mental images of desired outcomes or calming scenarios. It can help reduce anxiety, boost confidence, and improve performance by training your mind."
"What are the mental health benefits of volunteering or helping others?","Volunteering can boost self-esteem, reduce feelings of isolation, provide a sense of purpose, increase social connections, and improve mood by shifting focus outward."
"How can I manage the emotional impact of social media comparison?","Manage it by recognizing that social media often presents curated highlights, limiting exposure to triggering content, focusing on your own progress, and practicing self-compassion."
"What is Dialectical Behavior Therapy (DBT), and who does it help?","DBT is a type of CBT that helps people regulate emotions, tolerate distress, improve interpersonal relationships, and be more mindful. It's often used for borderline personality disorder and chronic suicidal ideation."
"How can I support someone experiencing anxiety without enabling their avoidance?","Offer support and empathy, but gently encourage them to face their fears in small, manageable steps. Avoid doing things for them that they can do themselves, which might reinforce avoidance."
"What are some common challenges in navigating the mental healthcare system?","Challenges include stigma, cost, lack of insurance coverage, shortage of providers, geographical barriers, and difficulty navigating the healthcare system."
"How does perfectionism contribute to anxiety and depression?","Perfectionism often leads to chronic stress, fear of failure, avoidance, self-criticism, and feelings of inadequacy, all of which contribute to anxiety and depression."
"What is the concept of ""toxic positivity,"" and why can it be harmful?","Toxic positivity is the excessive and ineffective overgeneralization of a happy and optimistic state across all situations. It can be harmful because it dismisses genuine emotions, prevents processing of difficult feelings, and creates pressure to always be ""fine."" "
"How can I use body scans to improve mindfulness and reduce stress?","A body scan involves paying attention to sensations in different parts of your body, without judgment. It helps ground you in the present moment, reduces physical tension, and increases body awareness."
"What are the mental health benefits of spending time with animals?","Spending time with animals can reduce stress, lower blood pressure, alleviate loneliness, and provide a sense of comfort and unconditional affection."
"How can I build stronger social connections for better mental health?","Build stronger social connections by actively participating in groups or communities, reaching out to friends and family, being a good listener, and showing genuine interest in others."
"What is the link between chronic sleep problems and mental health disorders?","Chronic sleep problems are both a symptom and a risk factor for mental health disorders like depression and anxiety. Poor sleep can disrupt brain chemistry and emotional regulation."
"How can I practice effective self-care when I have limited time or resources?","Even with limited time, prioritize small, consistent acts of self-care: a few minutes of deep breathing, a short walk, listening to music, or connecting with a loved one."
"What are the signs of a healthy family dynamic from a mental health perspective?","Signs include open communication, mutual respect, clear boundaries, emotional support, effective conflict resolution, and the ability to adapt to change."
"How can I help someone who is reluctant to open up about their mental health?","Create a safe, non-judgmental space, listen actively, express empathy, avoid pressuring them, and offer practical support without forcing them to share more than they're comfortable with."
"What is the concept of ""languishing"" in mental health, and how can I address it?","Languishing is a state of stagnation, emptiness, and lack of joy, but without the severe symptoms of depression. Address it by finding small wins, engaging in meaningful activities, and seeking connection."
"How does spirituality contribute to coping with mental health challenges?","Spirituality can provide a framework for meaning and purpose, a sense of hope, a supportive community, and practices like prayer or meditation that foster inner peace and resilience."
"What are some strategies for managing test anxiety?","Strategies include preparation, relaxation techniques (deep breathing), positive self-talk, reframing thoughts about the test, and getting adequate sleep before the exam."
"How can I encourage healthy eating habits for better mental health?","Focus on nutrient-dense foods, stay hydrated, limit processed foods and sugar, and be mindful of how certain foods make you feel, aiming for balanced and regular meals."
"What are the mental health benefits of learning a new skill?","Learning a new skill can boost confidence, provide a sense of accomplishment, improve cognitive function, reduce stress, and offer a positive distraction."
"How can I differentiate between normal sadness and clinical depression in a teenager?","Normal sadness in teens is usually transient. Clinical depression involves persistent sadness, irritability, loss of interest, significant changes in behavior, sleep, or appetite, and lasts for weeks or longer."
"What is the impact of chronic stress on the brain and mental health?","Chronic stress can shrink brain regions involved in memory and emotion regulation, increase inflammation, and elevate cortisol levels, contributing to anxiety, depression, and cognitive impairment."
"How can I use expressive writing to process difficult emotions?","Expressive writing involves writing freely about your thoughts and feelings without worrying about grammar or structure. It helps organize thoughts, gain perspective, and reduce emotional distress."
"What are the signs that someone is experiencing an emotional flashback related to trauma?","Signs include feeling suddenly overwhelmed by intense emotions (fear, shame, rage) that don't match the current situation, feeling like you're reliving a past event, and difficulty staying present."
"How can I improve my financial well-being to reduce mental stress?","Improve financial well-being by creating a budget, tracking spending, building an emergency fund, reducing debt, and seeking professional financial advice."
"What is the concept of ""toxic productivity,"" and how does it affect mental health?","Toxic productivity is an unhealthy obsession with always being productive, often driven by societal pressure or fear of not being ""enough."" It leads to burnout, stress, guilt, and neglecting self-care."
"How can I use grounding techniques to manage overwhelming emotions?","Grounding techniques help you connect to the present moment. Examples include focusing on your five senses, naming objects around you, doing a quick physical activity, or holding an ice cube."
"What are the mental health benefits of practicing forgiveness?","Practicing forgiveness (of self or others) can reduce anger, resentment, and stress, improve relationships, and promote a sense of peace and emotional freedom."
"How can I support a family member who has been diagnosed with a severe mental illness?","Educate yourself about their condition, encourage treatment adherence, offer practical support, practice patience, set healthy boundaries, and join support groups for families."
"What is the difference between mental health and mental illness?","Mental health refers to our overall emotional, psychological, and social well-being. Mental illness refers to diagnosable conditions that affect a person's thinking, feeling, mood, or behavior."
"How can I cope with feelings of hopelessness and helplessness?","Cope by breaking down problems, seeking support, engaging in small achievable activities, focusing on what you *can* control, and remembering that feelings are temporary. Professional help is essential if these feelings are persistent."
"What are the warning signs of an unhealthy relationship dynamics?","Warning signs include control, manipulation, disrespect, lack of trust, constant criticism, isolation from friends/family, and emotional or physical abuse."
"How can I use deep breathing exercises to calm anxiety?","Deep breathing (diaphragmatic breathing) involves slow, deep breaths that engage the diaphragm. It activates the parasympathetic nervous system, promoting relaxation and reducing heart rate and blood pressure."
"What are the benefits of volunteering in the mental health field?","Volunteering in the mental health field can provide valuable experience, foster empathy, reduce stigma, and offer a sense of purpose and contribution to a meaningful cause."
"How can I manage anticipatory anxiety about future events?","Manage anticipatory anxiety by identifying specific worries, challenging negative predictions, practicing relaxation techniques, focusing on the present, and developing a plan for the event if possible."
"What is ""compassion fatigue,"" and how can caregivers prevent it?","Compassion fatigue is emotional and physical exhaustion experienced by those who care for others. Prevention involves self-care, setting boundaries, debriefing, seeking supervision, and finding healthy outlets."
"How can I use humor to improve my mental well-being?","Humor can reduce stress, improve mood, provide perspective, and strengthen social connections. It's a coping mechanism that helps reframe challenges."
"What are the signs of a good work-life balance?","Signs include feeling energized, having enough time for personal activities, maintaining healthy relationships outside of work, experiencing less stress, and feeling fulfilled in both work and personal life."
"How does nutrition specifically affect brain function and mental health?","Good nutrition provides essential nutrients for neurotransmitter production, brain structure, and energy. Deficiencies can impair cognitive function, mood, and increase risk of mental health issues."
"What are some strategies for building confidence in social situations?","Strategies include starting small, practicing eye contact, initiating brief conversations, focusing on others, and challenging self-critical thoughts before and during interactions."
"How can I help a friend who is experiencing a manic episode?","Stay calm, speak in a gentle and reassuring tone, avoid arguing, help them stay safe, and encourage them to seek or stick to their professional treatment plan."
"What is solution-focused brief therapy (SFBT), and how does it differ from traditional therapy?","SFBT focuses on identifying solutions and building on existing strengths rather than dwelling on problems. It's typically shorter-term and more goal-oriented than traditional insight-based therapies."
"How can I use creative visualization to reduce stress and anxiety?","Creative visualization involves forming positive mental images of a desired outcome or a peaceful scene. It can help calm the nervous system and promote a sense of well-being."
"What are the mental health benefits of engaging in community activities?","Community activities foster a sense of belonging, reduce isolation, provide social support, increase self-esteem, and offer opportunities for personal growth and contribution."
"How can I cope with feelings of worthlessness and self-blame?","Cope by challenging negative self-talk, practicing self-compassion, focusing on your strengths, seeking support from trusted individuals or a therapist, and engaging in activities that bring a sense of accomplishment."
"What are the ethical responsibilities of a mental health professional?","Responsibilities include maintaining confidentiality, acting in the client's best interest, respecting autonomy, ensuring competence, and avoiding harm."
"How can I support a veteran or active military member struggling with PTSD?","Listen empathetically, avoid judgment, educate yourself about PTSD, encourage professional help, and connect them with veteran-specific support resources."
"What is cognitive reframing, and how can it help with anxiety?","Cognitive reframing is a technique to change the way you look at a situation, thought, or emotion. For anxiety, it helps you replace unhelpful or negative thought patterns with more realistic and positive ones."
"How can I identify if my child is experiencing an eating disorder, beyond just picky eating?","Look for extreme concern about weight/shape, secretive eating, excessive exercise, fear of certain foods, drastic changes in diet or weight, and body image distortion."
"What is the role of humor in therapy and mental health recovery?","Humor can build rapport in therapy, reduce tension, provide a sense of perspective, and make challenging situations feel more manageable, acting as a healthy coping mechanism."
"How can I manage my emotions more effectively in challenging situations?","Practice emotional regulation by identifying your emotions, understanding their triggers, using relaxation techniques, challenging unhelpful thoughts, and seeking constructive outlets for expression."
"What are the mental health benefits of regularly practicing gratitude daily?","Daily gratitude practice can increase positive emotions, improve satisfaction with life, enhance sleep quality, strengthen relationships, and reduce feelings of envy and resentment."
"How does social comparison affect mental health, and how can I mitigate it?","Social comparison (especially upward comparison on social media) can lead to feelings of inadequacy, envy, and low self-esteem. Mitigate it by limiting exposure, focusing on your own journey, and practicing self-acceptance."
"What are the signs of a good peer support system for mental health?","Signs include mutual respect, empathy, non-judgmental listening, shared experiences, a sense of belonging, and the ability to offer and receive support."
"How can I cope with feelings of emptiness or numbness?","Cope by engaging in meaningful activities, connecting with others, practicing mindfulness to reconnect with sensations, and seeking therapy to explore underlying causes."
"What is the concept of ""emotional intelligence,"" and why is it important for mental health?","Emotional intelligence is the ability to understand and manage one's own emotions, and to understand and influence the emotions of others. It's crucial for healthy relationships, stress management, and overall well-being."
"How can I use nature walks to improve my mental well-being?","Nature walks reduce stress, improve mood, increase cognitive function, and offer opportunities for mindfulness and connection with the environment."
"What are the mental health benefits of healthy boundaries in family relationships?","Healthy boundaries foster respect, prevent resentment, protect personal space and energy, and allow for healthier communication and relationships."
"How does exercise influence neurochemicals related to mood?","Exercise positively impacts mood regulation by increasing neurotransmitters like serotonin and dopamine, reducing cortisol (stress hormone), and providing a sense of accomplishment."
"What are some common forms of self-sabotage in mental health, and how can I break the cycle?","Common forms include procrastination, negative self-talk, avoiding challenges, and pushing people away. Break the cycle by recognizing patterns, practicing self-compassion, and taking small, actionable steps."
"How can I support someone going through a breakup or relationship loss?","Listen empathetically, validate their feelings, encourage healthy coping mechanisms, help them maintain routines, and gently remind them of their self-worth."
"What is expressive arts therapy, and what modalities does it use?","Expressive arts therapy uses various art forms (visual arts, dance, music, drama, writing) to help individuals explore emotions, reduce stress, and promote personal growth."
"How can I manage the impact of current events or news on my mental health?","Manage it by limiting news consumption, choosing reliable sources, focusing on actionable steps if possible, and maintaining self-care routines."
"What are the mental health benefits of pet ownership beyond companionship?","Beyond companionship, pets can reduce stress, lower blood pressure, provide structure, encourage physical activity, and offer a sense of purpose and responsibility."
"How can I use diaphragmatic breathing to reduce immediate anxiety?","Diaphragmatic breathing involves breathing deeply into your belly. It calms the nervous system, reduces heart rate, and helps alleviate acute anxiety symptoms quickly."
"What is the concept of ""resilience,"" and how can I build it in daily life?","Resilience is the ability to bounce back from adversity. Build it by practicing self-care, building strong relationships, learning from challenges, maintaining a positive outlook, and seeking support."
"How can I identify if I am experiencing compassion fatigue, and what steps should I take?","Identify compassion fatigue by symptoms like chronic exhaustion, irritability, emotional numbness, and difficulty empathizing. Take steps like setting boundaries, prioritizing self-care, seeking supervision, and connecting with peers."
"What are the mental health benefits of maintaining a consistent sleep schedule?","A consistent sleep schedule improves mood regulation, cognitive function, energy levels, and reduces the risk of developing or exacerbating mental health disorders."
"How can I overcome the fear of judgment in social situations?","Overcome fear of judgment by challenging negative thoughts, gradually exposing yourself to social situations, focusing on others, and practicing self-compassion."
"What are the different approaches to trauma-informed care?","Trauma-informed care recognizes the widespread impact of trauma and integrates knowledge about trauma into policies, procedures, and practices. Approaches prioritize safety, trustworthiness, peer support, collaboration, empowerment, and cultural sensitivity."
"How can I build stronger social connections for better emotional well-being?","Build stronger connections by actively engaging in communities, initiating conversations, showing genuine interest in others, being vulnerable, and offering support to those around you."
"What are some common warning signs of depression in adults?","Common signs include persistent sadness, loss of interest in activities, fatigue, changes in sleep/appetite, feelings of worthlessness, difficulty concentrating, and thoughts of self-harm."
"How does exposure therapy work for anxiety disorders?","Exposure therapy involves gradually exposing an individual to feared objects or situations in a safe environment to help them overcome their anxiety responses."
"What are the mental health benefits of a balanced diet?","A balanced diet provides essential nutrients for brain function, stabilizes blood sugar, and supports overall physiological processes that contribute to stable mood and cognitive health."
"How can I use mindfulness to improve my eating habits and relationship with food?","Mindfulness in eating involves paying full attention to the experience of eating, including flavors, textures, and hunger/satiety cues. It helps develop a healthier, more conscious relationship with food."
"What are the signs of a mental health professional who is a good fit for me?","Signs include feeling comfortable, heard, and respected; having clear goals for therapy; feeling challenged constructively; and seeing some progress over time."
"How can I manage the emotional impact of news and current events responsibly?","Limit news consumption, seek information from diverse and reliable sources, avoid sensationalized content, and focus on what you can control or contribute to."
"What are the mental health benefits of journaling specifically for managing stress?","Journaling for stress management helps you organize thoughts, identify stressors, process emotions, gain perspective, and track coping strategies that work."
"How can I support a loved one who is reluctant to seek professional help for their mental health?","Express your concern calmly, validate their feelings, share information about resources, offer practical support (e.g., help finding a therapist), and emphasize that it's a sign of strength to seek help."
"What is the impact of chronic loneliness on physical and mental health?","Chronic loneliness can lead to increased risk of depression, anxiety, cardiovascular disease, impaired immune function, and cognitive decline."
"How can I use positive affirmations to build self-compassion?","Positive affirmations for self-compassion involve repeating kind, understanding, and validating statements to yourself, especially during difficult times."
"What are the common benefits of engaging in hobbies for overall mental health?","Hobbies provide stress relief, a sense of accomplishment, opportunities for flow states, social connection (if group-based), and a healthy distraction from worries."
"How does gratitude specifically impact resilience and well-being?","Gratitude fosters resilience by helping individuals focus on resources and positive aspects, even during adversity, thereby increasing overall well-being and life satisfaction."
"What are the mental health benefits of developing a strong sense of purpose?","A strong sense of purpose provides direction, motivation, meaning, and can buffer against stress and feelings of hopelessness, contributing to greater life satisfaction."
