"question","answer"
"What are common symptoms of anxiety?","Common symptoms of anxiety include excessive worry, restlessness, difficulty concentrating, irritability, muscle tension, and sleep disturbances. These can vary in intensity and frequency."
"How can I manage stress effectively?","Effective stress management techniques include practicing mindfulness, regular exercise, maintaining a balanced diet, ensuring sufficient sleep, setting realistic goals, and engaging in hobbies or relaxation activities like deep breathing or meditation."
"What is depression and how is it diagnosed?","Depression is a mood disorder characterized by persistent sadness, loss of interest in activities, changes in appetite or sleep, fatigue, feelings of worthlessness, and suicidal thoughts. Diagnosis is typically made by a mental health professional based on a thorough evaluation of symptoms."
"Are there different types of therapy for mental health issues?","Yes, there are many types of therapy. Some common ones include Cognitive Behavioral Therapy (CBT), Dialectical Behavior Therapy (DBT), Psychodynamic Therapy, Family Therapy, and Group Therapy. The best type depends on the individual's needs and condition."
"How can I support a friend who is struggling with their mental health?","To support a friend, listen without judgment, offer practical help (like helping with errands), encourage them to seek professional help, and remind them that you care. Avoid giving unsolicited advice or minimizing their feelings."
"What role does exercise play in mental well-being?","Exercise is crucial for mental well-being as it releases endorphins, reduces stress hormones, improves sleep, and can boost self-esteem. Regular physical activity can significantly alleviate symptoms of depression and anxiety."
"When should I seek professional help for mental health concerns?","It's advisable to seek professional help when your mental health symptoms begin to significantly interfere with your daily life, relationships, work, or school. If you feel overwhelmed, hopeless, or have thoughts of self-harm, seek help immediately."
"What are some coping mechanisms for panic attacks?","During a panic attack, focus on deep breathing, ground yourself by noticing five things you can see, four you can hear, three you can touch, two you can smell, and one you can taste. Remind yourself it will pass and you are safe."
"Can diet affect my mood and mental health?","Yes, diet can significantly affect your mood. A diet rich in whole foods, fruits, vegetables, lean proteins, and omega-3 fatty acids can support brain health and stable mood. Conversely, processed foods and high sugar intake can negatively impact mood."
"What is mindfulness and how can it help with anxiety?","Mindfulness is the practice of being present and fully engaged in the current moment without judgment. For anxiety, it helps by shifting focus away from anxious thoughts, reducing rumination, and increasing awareness of physical sensations and emotions."
"How do I talk to my family about my mental health struggles?","Choose a calm time to talk, express how you feel using ""I"" statements, educate them about your condition, and explain what kind of support you need. Be patient, as it might take time for them to understand."
"What are the signs of burnout, and how can I recover from it?","Burnout signs include chronic fatigue, cynicism, detachment, reduced performance, and feelings of ineffectiveness. Recovery involves setting boundaries, taking breaks, delegating tasks, practicing self-care, and potentially seeking therapy."
"Is there a difference between sadness and depression?","Yes, sadness is a normal human emotion, often a temporary response to loss or disappointment. Depression is a persistent mental illness with a broader range of symptoms that significantly impair daily functioning over an extended period."
"How can I improve my sleep for better mental health?","Improve sleep by maintaining a consistent sleep schedule, creating a relaxing bedtime routine, avoiding caffeine and screens before bed, ensuring your bedroom is dark and cool, and getting regular exercise."
"What are the benefits of journaling for mental health?","Journaling can help you process emotions, identify thought patterns, reduce stress, improve problem-solving skills, track progress in therapy, and gain clarity on your feelings and experiences."
"What is bipolar disorder, and what are its main symptoms?","Bipolar disorder is a mental health condition characterized by significant mood swings, including emotional highs (mania or hypomania) and lows (depression). Symptoms can include changes in energy, sleep, activity levels, and unusual thought patterns."
"How can I overcome feelings of loneliness and isolation?","Overcoming loneliness involves reaching out to friends and family, joining social groups or clubs, volunteering, pursuing hobbies that involve others, and being open to new connections. Therapy can also help address underlying issues."
"What are the early warning signs of a mental health crisis?","Early warning signs include severe mood swings, social withdrawal, drastic changes in behavior or personality, increased agitation, paranoia, hallucinations, and thoughts of harming oneself or others."
"How does therapy work, and what should I expect in a session?","Therapy provides a safe and confidential space to explore your thoughts, feelings, and behaviors with a trained professional. Sessions typically involve talking, setting goals, learning coping strategies, and gaining new perspectives."
"Can meditation help with anxiety and stress reduction?","Yes, meditation is highly effective for anxiety and stress reduction. Regular practice can calm the mind, reduce physiological arousal, improve emotional regulation, and increase overall well-being."
"What are ways to boost self-esteem and confidence?","To boost self-esteem, practice positive self-talk, set achievable goals, celebrate small victories, learn new skills, help others, and avoid comparing yourself to others."
"How can I manage anger in a healthy way?","Healthy anger management involves identifying triggers, practicing relaxation techniques (deep breathing, counting), expressing feelings assertively, and seeking therapy if anger becomes overwhelming or destructive."
"What is PTSD, and how is it treated?","PTSD (Post-Traumatic Stress Disorder) is a mental health condition triggered by experiencing or witnessing a terrifying event. Treatment often includes trauma-focused psychotherapy (like EMDR or Cognitive Processing Therapy) and sometimes medication."
"How can I maintain positive mental health in daily life?","Maintain positive mental health by practicing self-care, building strong relationships, engaging in meaningful activities, staying physically active, managing stress, and seeking help when needed."
"What is the difference between a psychiatrist and a psychologist?","A psychiatrist is a medical doctor who can prescribe medication and often focuses on biological aspects of mental illness. A psychologist typically has a doctoral degree in psychology and provides therapy, focusing on behavioral and emotional aspects."
"How can I cope with grief after losing a loved one?","Coping with grief involves allowing yourself to feel emotions, seeking support from friends or family, engaging in self-care, remembering your loved one, and considering grief counseling if needed."
"What are some common misconceptions about mental illness?","Common misconceptions include believing mental illness is a sign of weakness, that people can just ""snap out of it,"" or that it's always visible. Mental illnesses are complex medical conditions, not character flaws."
"How can I set healthy boundaries in relationships?","Set healthy boundaries by identifying your limits, communicating them clearly and assertively, being consistent in enforcing them, and understanding that it's okay to say no."
"What is generalized anxiety disorder (GAD)?","Symptoms of GAD include persistent and excessive worry about various things (health, work, relationships) for at least six months, accompanied by physical symptoms like restlessness, fatigue, muscle tension, and sleep disturbances."
"Can lifestyle changes improve mental health outcomes?","Absolutely. Lifestyle changes such as regular exercise, a balanced diet, adequate sleep, mindfulness practices, stress management techniques, and strong social connections can significantly improve mental health outcomes."
"What resources are available for urgent mental health support?","For urgent support, call a crisis hotline (like the National Suicide Prevention Lifeline), go to the nearest emergency room, or contact a local mental health crisis team."
"How does social media impact mental health?","Social media can have both positive and negative impacts. While it can foster connection, excessive use or exposure to idealized content can lead to feelings of inadequacy, anxiety, depression, and social comparison."
"What are cognitive distortions, and how can I challenge them?","Cognitive distortions are irrational or biased ways of thinking that negatively affect your emotions. Examples include black-and-white thinking, catastrophizing, and overgeneralization. Challenging them involves identifying them and actively seeking more balanced perspectives."
"How can I develop resilience in the face of adversity?","Develop resilience by building strong relationships, setting realistic goals, practicing self-care, maintaining a positive outlook, learning from experiences, and seeking support when challenged."
"What is self-harm, and what should I do if I know someone who self-harms?","Self-harm is intentionally causing injury to one's own body as a way to cope with intense emotional pain. If you know someone who self-harms, approach them with care, encourage them to seek professional help, and offer support without judgment."
"Are there natural remedies or supplements for mental health?","While some natural remedies and supplements (like Omega-3s, St. John's Wort) are researched for mental health, they should always be discussed with a healthcare professional as they can interact with medications or have side effects."
"How can I deal with intrusive thoughts?","Dealing with intrusive thoughts involves acknowledging them without judgment, understanding they are just thoughts, not commands, and redirecting your attention. CBT and ERP (Exposure and Response Prevention) therapies are often helpful."
"What is therapy for children, and how is it different from adult therapy?","Therapy for children often incorporates play, art, and storytelling to help them express feelings, as verbal communication might be limited. Therapists also often work closely with parents or guardians."
"How can I overcome procrastination related to anxiety or depression?","Overcoming procrastination often involves breaking tasks into smaller steps, setting realistic deadlines, rewarding yourself for progress, addressing underlying anxiety or low energy, and practicing self-compassion."
"What are signs of an eating disorder, and how can I help someone with one?","Signs include extreme weight fluctuations, obsession with food/body image, secretive eating, excessive exercise, and distorted body perception. Encourage them to seek professional help from a team specializing in eating disorders."
"How can I practice gratitude for better mental health?","Practice gratitude by keeping a gratitude journal, regularly listing things you're thankful for, expressing appreciation to others, and taking time to savor positive experiences."
"What is attention-deficit/hyperactivity disorder (ADHD) in adults?","ADHD in adults involves persistent patterns of inattention, hyperactivity, and impulsivity that interfere with functioning or development. Symptoms can include difficulty with focus, organization, time management, and restlessness."
"How do medications for mental health conditions work?","Mental health medications primarily work by adjusting the balance of neurotransmitters (chemical messengers) in the brain, which can help regulate mood, thought patterns, and behavior. They are often used in conjunction with therapy."
"What are some techniques for managing social anxiety?","Managing social anxiety involves gradually exposing yourself to social situations, challenging negative thoughts, practicing relaxation techniques, focusing on others, and practicing social skills."
"How can I support my own mental health during a global crisis or pandemic?","During a crisis, focus on what you can control, stay informed from reliable sources, limit news consumption, maintain routines, connect with loved ones, practice self-care, and seek professional help if needed."
"What is the role of spirituality or religion in mental health?","For many, spirituality or religion can provide a sense of purpose, community, hope, and coping mechanisms, contributing positively to mental well-being. It's a personal journey."
"How do I differentiate between normal stress and an anxiety disorder?","Normal stress is temporary and usually tied to a specific stressor. An anxiety disorder involves excessive, persistent worry that is disproportionate to the situation, difficult to control, and significantly impacts daily life."
"What is schizophrenia, and what are its key symptoms?","Schizophrenia is a chronic mental disorder characterized by distortions in thinking, perception, emotions, language, sense of self, and behavior. Key symptoms include hallucinations, delusions, disorganized thinking and speech, and decreased motivation."
"How can I improve my communication skills for healthier relationships?","Improve communication by practicing active listening, expressing your needs and feelings clearly and respectfully, using ""I"" statements, avoiding assumptions, and learning to resolve conflicts constructively."
"What is the concept of self-care, and why is it important?","Self-care involves engaging in activities that maintain or improve your physical, mental, and emotional health. It's important because it helps manage stress, prevent burnout, and promote overall well-being."
"How can I encourage someone to go to therapy if they are resistant?","Gently express your concerns, share specific observations, avoid being judgmental, offer to help them find a therapist, and emphasize that therapy is a tool for strength and growth, not weakness."
"What are the benefits of setting boundaries in friendships?","Setting boundaries in friendships helps maintain respect, prevents feeling overwhelmed or taken advantage of, fosters healthier communication, and ensures that your needs are met while maintaining balance in the relationship."
"How does exercise help with reducing symptoms of depression?","Exercise helps reduce depression symptoms by releasing endorphins (natural mood lifters), improving sleep, reducing inflammatory markers, increasing social interaction if done with others, and providing a sense of accomplishment."
"What are some effective strategies for time management when struggling with motivation?","Break tasks into smaller, manageable steps; use productivity tools like planners or apps; identify your most productive times; eliminate distractions; and practice the ""two-minute rule"" (if it takes less than two minutes, do it now)."
"How can I identify if someone is having suicidal thoughts, and what should I do?","Look for direct or indirect statements about dying, increased withdrawal, hopelessness, sudden calmness after depression, giving away possessions. If you suspect suicidal thoughts, ask directly, listen non-judgmentally, and connect them immediately to professional help."
"What is obsessive-compulsive disorder (OCD), and how is it treated?","OCD is characterized by unwanted, intrusive thoughts (obsessions) that lead to repetitive behaviors or mental acts (compulsions) aimed at reducing anxiety. Treatment often involves Cognitive Behavioral Therapy (specifically Exposure and Response Prevention) and medication."
"How can I practice self-compassion when feeling overwhelmed?","Practice self-compassion by treating yourself with the same kindness you would offer a friend, acknowledging your suffering, and understanding that imperfection is part of the human experience."
"What are the different types of anxiety disorders?","Besides Generalized Anxiety Disorder, other types include Panic Disorder, Social Anxiety Disorder, Specific Phobias, Separation Anxiety Disorder, and Agoraphobia."
"How does trauma affect the brain and mental health?","Trauma can alter brain structure and function, affecting areas involved in fear, memory, and emotion regulation. This can lead to symptoms like flashbacks, hypervigilance, emotional numbness, and difficulty forming relationships."
"What are the pros and cons of using mental health apps?","Pros: accessibility, affordability, anonymity, convenience. Cons: not a substitute for professional help, privacy concerns, varying quality, lack of personalized interaction."
"How can I create a mental health ""toolkit"" for myself?","A mental health toolkit could include journaling, meditation apps, stress balls, comfort items, a list of calming activities, contact info for support, and positive affirmations."
"What are the signs of a healthy therapeutic relationship?","Signs include feeling heard and understood, trust in your therapist, a sense of progress, clear goals, and feeling challenged constructively in a safe environment."
"How can I cope with seasonal affective disorder (SAD)?","Cope with SAD by using a light therapy lamp, spending time outdoors in daylight, regular exercise, maintaining a healthy diet, and considering therapy or medication if symptoms are severe."
"What is imposter syndrome, and how can I overcome it?","Imposter syndrome is the persistent inability to believe that one's success is deserved or legitimately achieved, accompanied by a fear of being exposed as a ""fraud."" Overcome it by acknowledging your feelings, tracking achievements, seeking mentorship, and focusing on contribution rather than perfection."
"How can I manage stress in a high-pressure job?","Manage stress in a high-pressure job by setting clear boundaries between work and personal life, practicing stress-reduction techniques during breaks, delegating tasks, and ensuring you get enough rest."
"What are the benefits of group therapy?","Group therapy offers benefits like shared experiences, reduced feelings of isolation, diverse perspectives, a sense of community, and the opportunity to practice social skills in a supportive environment."
"How can I support someone experiencing a psychotic episode?","Stay calm, speak clearly and gently, avoid arguing or challenging their delusions/hallucinations, ensure their safety, and seek immediate professional help."
"What is the link between gut health and mental health?","The gut-brain axis is a bidirectional communication system. A healthy gut microbiome can influence neurotransmitter production and reduce inflammation, impacting mood and cognitive function."
"How can I build a strong support system for my mental health?","Build a support system by nurturing existing positive relationships, joining support groups or clubs, volunteering, and being open to new connections. Therapy can also help."
"What are some ways to practice emotional regulation?","Practice emotional regulation by identifying and labeling emotions, taking a pause, practicing deep breathing, engaging in calming activities, and challenging unhelpful thought patterns."
"How can I deal with chronic pain and its impact on mental health?","Chronic pain can lead to depression and anxiety. Management involves a multidisciplinary approach: pain management, therapy (CBT), physical therapy, mindfulness, and support groups."
"What are the ethical considerations in mental health care?","Ethical considerations include patient confidentiality, informed consent, therapist competence, avoiding dual relationships, and ensuring non-discrimination."
"How can I differentiate between normal shyness and social anxiety disorder?","Normal shyness is a personality trait that doesn't significantly impair daily life. Social anxiety disorder involves intense fear of social situations, fear of judgment, avoidance, and significant distress or impairment."
"What are the signs of caregiver burnout, and how can it be prevented?","Caregiver burnout signs include exhaustion, resentment, withdrawal, changes in appetite/sleep, and loss of interest. Prevention involves setting boundaries, seeking respite care, joining support groups, and prioritizing self-care."
"How can I use positive affirmations to improve my mental well-being?","Use positive affirmations by choosing statements that resonate with you, repeating them regularly, visualizing their truth, and pairing them with positive actions."
"What is art therapy, and how can it help with mental health?","Art therapy uses creative processes (painting, drawing, sculpting) to explore emotions, reduce stress, improve self-esteem, and manage behaviors. It's especially useful for those who struggle to verbalize feelings."
"How can I help a teenager who is struggling with mental health issues?","Listen without judgment, validate their feelings, encourage open communication, educate yourself about teen mental health, and seek professional help from a child and adolescent therapist or psychiatrist."
"What are some common triggers for anxiety attacks?","Common triggers include stress, caffeine, certain medications, specific phobias, social situations, past trauma, or even feeling overwhelmed."
"How can I improve my body image and self-acceptance?","Improve body image by focusing on what your body can do, practicing self-compassion, unfollowing social media accounts that promote unrealistic ideals, and challenging negative self-talk."
"What is the impact of sleep deprivation on mental health?","Sleep deprivation significantly impairs mental health, leading to irritability, mood swings, difficulty concentrating, increased stress, and exacerbation of existing mental health conditions."
"How can I help someone who is having a panic attack in front of me?","Stay calm, speak in a soothing voice, remind them to breathe slowly, help them find a quiet space, and reassure them that the attack will pass."
"What are the benefits of journaling for mental health?","Journaling can help you process emotions, identify thought patterns, reduce stress, improve problem-solving skills, track progress in therapy, and gain clarity on your feelings and experiences."
"How can I encourage healthy digital habits for better mental well-being?","Encourage healthy digital habits by setting screen time limits, having tech-free zones, avoiding endless scrolling, being mindful of content consumption, and prioritizing in-person interactions."
"What is adjustment disorder, and how is it treated?","Adjustment disorder is a short-term, stress-related condition that occurs after a major life change or stressful event. Treatment typically involves psychotherapy and coping skills training."
"How can I manage feelings of guilt and shame in a healthy way?","Manage guilt and shame by acknowledging the feelings, identifying their source, apologizing if necessary, making amends, learning from mistakes, and practicing self-forgiveness."
"What are the common challenges in accessing mental healthcare?","Challenges include stigma, cost, lack of insurance coverage, shortage of providers, geographical barriers, and difficulty navigating the healthcare system."
"How can pets contribute to positive mental health?","Pets provide companionship, reduce loneliness, encourage physical activity, offer unconditional love, and can lower stress levels through their calming presence."
"What is the difference between sadness and grief?","Sadness is a general emotion. Grief is a profound, multifaceted response to loss, encompassing emotional, physical, cognitive, and spiritual reactions, and often involves a unique grieving process."
"How can I build empathy for others who are struggling with mental illness?","Build empathy by educating yourself, listening to personal stories, challenging stereotypes, and recognizing that mental illness is a complex medical condition."
"What are some practical tips for managing work-life balance?","Practical tips include setting clear work hours, scheduling personal time, learning to say no, delegating tasks, taking regular breaks, and disconnecting from work during off-hours."
"How does exercise impact mood regulation?","Exercise positively impacts mood regulation by increasing neurotransmitters like serotonin and dopamine, reducing cortisol (stress hormone), and providing a sense of accomplishment."
"What are the signs of a codependent relationship, and how can I address it?","Signs include excessive reliance on others for self-worth, difficulty with boundaries, prioritizing others' needs over your own, and fear of abandonment. Addressing it often requires therapy to develop self-reliance and healthy boundaries."
"How can I support someone experiencing psychosis?","Stay calm, speak in a gentle and reassuring tone, avoid arguing, help them stay safe, and encourage them to seek or stick to their professional treatment plan."
"What is somatic therapy, and how does it help with trauma?","Somatic therapy focuses on the body's sensations to address trauma. It helps release trapped energy and promote healing by allowing the body to process and complete physiological responses to trauma."
"How can I use positive self-talk to improve my mental well-being?","Positive self-talk involves replacing negative or critical thoughts with encouraging and realistic ones. It helps reframe challenges, reduce stress, and boost self-esteem."
